company_name,request_url,request_company_url,location,tags,founding_date,founders,employee_range,urls,emails,phones,description_short,description
S4S Technologies,https://e27.co/startup/s4s-technologies,http://s4stechnologies.com/,India,Hardware,,,,,,,S4S Technologies is the food preservation company that invents new food processing machines.,S4S Technologies is the food preservation company that invents new food processing machines. We sell these machines to farmers or use these machines at our own facility to produce best quality processed food.
Chee-Ron's,https://e27.co/startup/cheerons,http://cheerons.in,India,,May 2015,,,"http://www.twitter.com/cheerons,http://www.facebook.com/cheerons,http://www.linkedin.com/company/chee-ron's",,,Cheerons Training & Consultancy is a Leading Digital Marketing Training Institute in Bangalore providing Advanced High-Quality Digital Marketing Training in Bangalore with Real-Time projects,"Cheerons Training & Consultancy is a Leading Digital Marketing Training Institute in Bangalore providing Advanced High-Quality Digital Marketing Training in Bangalore with Real-Time exposure with live Projects. We use the Most advanced Training techniques with a combination of assignments, projects and Internship programs. we are not only focusing on Training and internship, we provide placements also."
Smarther Solutions,https://e27.co/startup/smarther-solutions,https://www.smarther.co/,India,,,,,"http://www.twitter.com/smarthertech,https://www.facebook.com/smarther.co/,https://www.linkedin.com/company/smarther",,,We are the leading Mobile and Web Development Company. We’ve been delivering innovative solutions through our products and services for our clients in more than 20 countries.,Our team of young and dynamic experts are efficiently using their technical skills to enable the needed solutions for both web and mobile app development. Our entire team of experts are serving with diligence and intelligence to develop and to deliver interactive and cost effective products on satisfying the clients and with any compromising on the quality.
99japan,https://e27.co/startup/99japan,https://99japan.com,Japan,E-commerce,February 2018,,,,,,Your shopping destination for everything Japanese,
Go Big Finance & Mentorship Hub,https://e27.co/startup/go-big-finance-mentorship-hub,http://www.gobighub.com,Uganda,Finance,November 2015,,,"http://www.twitter.com/gobighub?lang=en,https://web.facebook.com/gobighub/?_rdc=1&_rdr,https://www.linkedin.com/company/go-big-finance-and-mentorship-hub",,,"Many people get contracts but lack cash, or collateral, or banking history to get capital to fulfil the orders. GoBigHub.com finances them on profit share basis. We raise funds from investors at 5% pm","Many people get contracts but lack funds to fulfil the orders. At GoBigHub.com, we believe people who have (won) contracts deserve an efficient way to access finance to fulfil the contracts. We offer investors opportunity to grow their capital by 5% every month and opportunity to cause impact since every USD. 1,000 invested will create one job and fight poverty while helping entrepreneurs who are financially secluded from accessing financing due to lack of collateral or banking history. Through our GoBig Contract Crowdfunding Platform on website, gobighub.com, and mobile app, gobighub, entrepreneurs post their contracts for potential investors to finance. Through our GoBig Contract Financing Fund, which is capitalized by individual investors, we finance contracts through profit sharing, no collateral. In year 1, we had revenue of USD. 23,501. In the second financial year, 2016, we had revenues of USD. 47,825. In 2017, we had revenues of USD. 98,718. We currently have USD. 3.7m worth of contracts seeking financing. This year, 2018, we target a capitalization of USD. 5 million which will help us reach approximately USD. 10m in revenues. The investors can exit quarterly taking 5% interest monthly for short term (1 year) investors or wait to exit at end of term for long term (5 year) investors taking 10x return on investment. Our team is comprised of three full time employees, part time contract agents, a board, outsourced consultants, advisors, and interns."
HokuApps,https://e27.co/startup/hokuapps,http://hokuapps.com,Singapore,,,,,,,,"FASTEST web & mobile apps development though the Rapid Application Development technology. Empowering organizations to better engage with customers, partners and employees. #digitaltransformation",
Any Colleges,https://e27.co/startup/any-colleges,http://anycolleges.com,India,,,,,,,,"Any Colleges in a single platform where you can find the all information of schools, colleges and universities from various places and location which will be very helpful by students.",
Mobiversa Sdn Bhd,https://e27.co/startup/mobiversa-sdn-bhd,http://www.mobiversa.com,Malaysia,B2B/Enterprise,August 2014,,,"http://www.twitter.com/mobiversa,https://www.facebook.com/Mobiversa/,https://www.linkedin.com/company/mobiversa/",,,Mobiversa enables your business growth via cashless and cardless payment solutions.,Mobiversa’s mission is to provide mobile payment services. Our omnichannel payment solution helps our merchants accept payments from their customers in-store or anywhere in the world.
Global Financial Services ,https://e27.co/startup/global-financial-services,https://www.globalfinance.co.nz,New Zealand,,March 1999,,,https://www.linkedin.com/company/9492207/,,,"Global Finance Limited is one of the leading mortgage and insurance agency in Auckland, New Zealand. We are highly respected, trusted and awarded agency. We have been helping kiwi families to reach",A little about us:
Noveco Systems Pty.Ltd,https://e27.co/startup/noveco-systems-pty-ltd,https://www.novecosystems.com,Australia,Consulting,,,,"http://www.twitter.com/novecosystem,https://www.facebook.com/novecosystems,https://in.linkedin.com/company/noveco-systems",,,"Noveco Systems assists the project managers who run SAP Project Systems (SAP PS),Consulting activities in the following countries: Australia, New Zealand, Korea, Japan, Malaysia, Hong Kong, India.","Noveco Systems assists the project managers who run SAP Project Systems (SAP PS). Our expert team has built solutions that provide important functions to manage the projects in SAP system directly. Through our SAP project management software, we aim to provide our clients with a powerful platform that help transform the way SAP businesses manage their projects. Now, no more use of excel sheets, interfaces or middleware. We help our clients as SAP project builder, helping them to work smarter and get better results with less effort."
Traffic Engineering Australia,https://e27.co/startup/traffic-engineering-australia,https://www.trafficengineeringaustralia.com.au/,Australia,,,,,"http://www.twitter.com/trafficengaus,https://www.facebook.com/Traffic-Engineering-Australia-236206400286714/",,,"Traffic Engineering Australia is a renowned name in the industry Specialising in traffic management designs, plans and solutions.","With more than 15 years of industry experience, Traffic Engineering Australia is a renowned name in the industry specialising in traffic management design, plan and solutions."
CouponsMonk,https://e27.co/startup/couponsmonk,https://www.couponsmonk.com/,United States of America,,,,,"http://www.twitter.com/CouponsMonk,http://www.facebook.com/CouponsMonkUSA/",,,CouponsMonk is one of the most active coupon curation sites.,"CouponsMonk is one of the most active coupon curation sites. It lists coupons by category and brand, but it often focuses on particular niches, hand-pick deals from across the web to share the best ones with its users, and heavily rely on users to help them organize these coupons."
Moon Invoice,https://e27.co/startup/moon-invoice,https://www.mooninvoice.com/?utm_source=marketing&utm_medium=organic,United States of America,,June 2009,,,"http://www.twitter.com/mooninvoice,https://www.facebook.com/mooninvoice/,https://www.linkedin.com/company/moon-invoice/",,,Moon Invoice is unique and 1st invoice app with iCloud sync for iOS and Mac OSX for small businesses and individual.,"Moon Invoice is easy to use with simplest user-interface, cutting-edge features, and multi-productive functionalities. Designed and developed with futuristic invoicing solutions, we guarantee that Moon Invoice will always remain in your recent history"
Seven Dimensions,https://e27.co/startup/seven-dimensions,https://sevendimensions.in/,India,Architecture & Construction,,,,http://fb.com/sevendimensions.in,,,"Seven Dimensions, One of the Best Interior Designing Company in Chennai And We are Doing Home Renovation Over Past 10 Years. We are Providing All Kinds of Services to Residential & Commercial Interior",
Policy Planner,https://e27.co/startup/policy-planner,https://www.policyplanner.in,India,,,,,,,,"We are Web aggregator Policy Planner Pvt. Ltd. You Can compare & Buy Online Insurance Within 2 Min , Like Health Insurance, Car Insurance, Bike Insurance, Travel Insurance, Life Insurance, Investment",
Involve Asia Technology,https://e27.co/startup/involve-asia-technology,https://productnation.co/th/,Thailand,,,,,,,,,
WAMP Institute Pvt Ltd,https://e27.co/startup/wamp-institute-pvt-ltd,https://www.wampinstitute.in,India,,May 2015,,,"http://www.twitter.com/wampinstitute,https://www.facebook.com/wampinstitute",,,"WAMP Institute is an institute for digital marketing courses, which provides the students with knowledge about digital media and marketing.","WAMP Institute is an institute for digital marketing courses, which provides the students with knowledge about digital media and marketing. It is located in various other countries. It is considered as one of the best in the particular field as they have micro-batches that are 5 to 6 students in each batch; we have highly qualified trainers who have been working in the Digital Marketing field. We focus on practical training rather than theoretical training, students are also provided with internships and they also work on live projects to gain experience."
SKARTEC Digital Marketing Academy,https://e27.co/startup/skartec-digital-marketing-academy,https://skartecedu.in,India,Education,December 2015,,,"http://www.twitter.com/skartecacademy,https://facebook.com/skartecacademy,https://linkedin.com/in/digitalsuresh",,,SKARTEC Digital Marketing Academy gives you the most powerful launch pad possible for your digital marketing career. Our goal is to transform students into 360-degree marketing professionals.,"SKARTEC Digital Marketing Academy gives you the most powerful launch pad possible for your digital marketing career, anywhere in the world. Our goal is to transform students into 360-degree marketing professionals who can bring about change in a fast-evolving world."
Puresoftware Pvt Ltd   ,https://e27.co/startup/puresoftware,http://puresoftware.com/,Singapore,,2005,,,"http://www.twitter.com/PureSoftware,https://www.facebook.com/PureSoftware1,https://www.linkedin.com/company/puresoftware/",,,PureSoftware is providing software solutions that help IT transform conventional businesses into advanced digital enterprises,"PureSoftware is a software product and services company that focuses on driving a differentiated customer experience, accelerating cycle time and improving business outcomes through an integration of digital solutions, robotic automation, and non-linear commercial models. PureSoftware provides value-driven services and solutions to its customers by leveraging its offerings in Digital, Product Engineering and Application Development and Management. These services are applicable across industries including Telecom, Financial Services, Life Sciences, Hi-Tech, and Gaming."
Binary Informatics Software Company,https://e27.co/startup/binary-informatics-software-company,http://binaryinformatics.com/,United States of America,,,,,,,,"Binary Informatics is a leading Technology and Digital Product Service company headquartered in Noida, India an office in San Francisco.",
Movel AI Pte Ltd,https://e27.co/startup/movel-ai-pte-ltd,http://www.movel.ai,Singapore,Robotics,,,,,,,Movel AI is a deep technology company building advanced Artificial Intelligence (AI) systems for robot navigation using sensor fusion and deep learning.,Introduction:
Arttha,https://e27.co/startup/arttha,http://arttha.com/,India,,2005,,,"http://www.twitter.com/arttha_fintech,https://www.facebook.com/ArtthaMobilePayments,https://www.linkedin.com/company/arttha-mobile-payments/",,,"In the digital payments world, ‘Arttha’, by PureSoftware, is one of the fastest growing technology platforms for Digital Banking, Core Banking and Digital Wallet","Arttha, an initiative by PureSoftware, is one of the fastest growing technology providers in the mobile payments world. With a focus on business execution and process optimization, it delivers high-performance technologies while ensuring minimal operational costs for service providers. It provides a one platform solution for consumer-facing financial services, including cards, devices, vouchers, loans, agent management, and multi-currency transactions."
Nurysh,https://e27.co/startup/nurysh,https://nurysh.com,United States of America,,,,,"http://www.twitter.com/Nuryshskincare,https://www.facebook.com/nuryshrx/",,,"We are an evidence-based clinical skin care company, providing an effective anti-aging device and professional skin care products for the best skin care solutions. For further details, visit our website now.",
DQMpro,https://e27.co/startup/dqmpro,http://www.dqmpro.com/,United States of America,Accounting,,,,,,,DQMpro is one of the best email list providers in the USA.,DQMpro is one of the best email list providers in the USA. We are providing highly verified and responsive email lists to enhance brand visibility as well as generate more qualified leads. Our data professionals have built an error-free mailing database that can add value to your b2b multi-channel campaigns and grow your customer base as well.
Icontek,https://e27.co/startup/icontek,http://www.icontek.com/,Canada,Software,,,,https://www.linkedin.com/company/icontek/,,,Icontek is dedicated to the advancement of behavioral analysis and natural language processing (NLP) for the enterprise market,"Icontek is dedicated to the advancement of behavioral analysis and natural language processing (NLP) for the enterprise market. We are R&D-focused, and committed to changing the way people think about machine learning and language, as well as the potential NLP holds."
MOBY'S Petshop,https://e27.co/startup/moby-s-petshop,http://mobyspetshop.com,Singapore,E-commerce,January 2017,,,"https://www.facebook.com/mobyspetshop/,https://www.linkedin.com/company/mobyspetshop/",,,"MOBY'S Petshop is the leading pet e-commerce company in Southeast Asia. Shop the hottest dog & cat food & supplies on your mobile, and get them delivered to your doorstep in 48h.",
Ideas2IT Technologies,https://e27.co/startup/ideas2it-technologies,https://www.ideas2it.com/,United States of America,B2B/Enterprise,February 2008,,,"http://www.twitter.com/ideas2it,https://www.facebook.com/Ideas2IT/,https://in.linkedin.com/company/ideas2it",,,"We are an innovation-led, digital transformation partner. Top notch technologies applied at the core of business.","Founded by an ex-Googler, Ideas2IT started its journey as a high-end product engineering partner for Silicon Valley startups. We honed our skills in solutioning, cutting-edge technology and go-to market strategies with them. As we grew, we added competencies in process, engagement model and delivery to work with enterprises. We are proud to be part of delivering innovative solutions for enterprises like Siemens and startups like DeVero to big exits. With a leadership team made of former entrepreneurs and big company executives, we have the right mix of passion and maturity to deliver futuristic solutions."
SBS Consulting Pte. Ltd.,https://e27.co/startup/sbs-consulting-pte-ltd,https://www.sbsgroup.com.sg/,Singapore,,January 2010,,,"http://www.twitter.com/SBS_Consulting,https://www.facebook.com/sbsgroupsg",,,"Incorporate Company in Singapore at SDG699. SBS Consulting Pte Ltd helps SMEs and Startups in Singapore by providing Accounting, Bookkeeping, Corporate Secretarial, XBRL Filing services at low cost.","SBS Consulting Pte Ltd is the proud winner of 'Singapore's 500 Enterprise Award 2018'. It is widely known for its reliability, promptness and affordable services in Singapore."
Co-Lab Architecture,https://e27.co/startup/co-lab-architecture,https://colabarchitects.com.au,Australia,,,,,"http://www.twitter.com/colabarchitects,https://www.facebook.com/pg/CoLabArchitectsMelbourne",,,Co-Lab Architecture is dedicated architecture firms in Melbourne specialised in residential and commercial designs.,"Co-Lab Architecture is one of the leading architecture firms in Melbourne specialising in creating unique and usable spaces for the residential and commercial facilities. By providing comprehensive architectural services including interior and landscape designs, we have built an enviable reputation of being the best architects in Melbourne."
Aihuishou,https://e27.co/startup/aihuishou,http://aihuishou.com/,China,E-commerce,,,,,,,"aihuishou.com (爱回收网) is a bidding-based C2B platform for recycling and the sale of selling second-hand electronic items such as mobile phones, laptops, and more.","aihuishou.com (爱回收网) is a bidding-based C2B platform for recycling and the sale of selling second-hand electronic items such as mobile phones, laptops, and more."
Mineral Assurance,https://e27.co/startup/mineral-assurance,http://mineralassurance.com,Australia,Architecture & Construction,March 2018,,,,,,"The MA Platform effectively creates a global data economy for the mining industry, where data providers and data users work together to create new opportunities for the global mining industry.",
engineeringhometuition,https://e27.co/startup/engineeringhometuition,http://engineeringhometuition.com/,India,,,,,,,,,
TaskUs,https://e27.co/startup/taskus,https://www.taskus.com/ph-taskus/,Philippines,,,,,,,,"At TaskUs, we promise four things: people, process, technology and transformational growth. As a progressive, new-age outsourcer, we are flexible, agile and quick to respond to clients’ shifting needs","At TaskUs, we promise four things: people, process, technology and transformational growth. As a progressive, new-age outsourcer, we are flexible, agile and quick to respond to clients’ shifting needs. People are our passion and our power."
handling emotions,https://e27.co/startup/handling-emotions,http://www.handlingemotions.in,India,,,,,,,,Handling Emotions is an experiential learning to must have Emotional - Social skills in kids to face today’s world and themselves.,
Jebhealth,https://e27.co/startup/jebhealth,https://jebhealth.com,Singapore,E-commerce,September 2016,,,"http://www.facebook.com/jebhealth,https://www.linkedin.com/company/jebhealth/",,,An online marketplace for healthcare services with a focus on preventive care in Southeast Asia.,"Since its creation in 2016, Jebhealth now houses a network of about 10,000 doctors and therapists, providing high-value preventive care services to users including: comprehensive health check-ups, preventive dental treatment, physiotherapy, family and specialist care services, as well as medical and dental aesthetics. As an online marketplace for healthcare services, Jebhealth has also expanded beyond local shores to countries such as Thailand and Vietnam, where Jebhealth has garnered the support of leading medical groups."
IVC services,https://e27.co/startup/ivc-services,http://ivc-services.com/India-visa-Singapore,Singapore,Legal Services,,,,,,,IVC Services provide Visa Consultancy services for Indian Nationals in Singapore. IVC helps in acquiring Visas of applicant's choice whether it is India Visa in Singapore or other country visas.,"Applying for India Visa? Are you worried on document preparation, online application, fake India Visa website?"
Inventory Software Services,https://e27.co/startup/inventory-software-services,https://inventorysoftwareservices.com,Bangladesh,Accounting,October 2017,Mohammad Ali,,"http://www.twitter.com/invsoftservices,https://facebook.com/inventorysoftwareservice,https://www.linkedin.com/company/inventory-software-services",,,Inventory Software Services provide web based inventory management services for small business management.,Inventory Software Services is a saas company provided inventory management services for small business owners. It founded by Moahammad Ali in 14 October in 2017 who is a software developer working with small business management for log time.
Avion Group of Companies ,https://e27.co/startup/avion-group-of-companies,http://www.avionindia.info/,India,,,,,,,,"Google apps partners available in the ground but AVON India is a leading and authorized Google G suite partner in India and across the world. When you collaborate with this company,",
CAP Rangers,https://e27.co/startup/cap-rangers,http://www.caprangers.co,Thailand,Jobs & Recruiting,,,,,,,CAP Rangers is an on-demand part-time job platform that connects students looking for a placement and companies recruiting on such positions. The applicants can submit their resume online.,CAP Rangers is an on-demand part-time job platform that connects students looking for a placement and companies recruiting on such positions. The applicants can submit their resume online.
Tife,https://e27.co/startup/tife,http://www.tife.com.my,Malaysia,B2B/Enterprise,April 2018,Hong Quan,,https://www.facebook.com/mytifeteam/,,,Providing simple solutions to public transport commuters in Malaysia.,The market is ripe for our solutions because of rapid expansions of public transport infrastructure in Malaysia.
AntWorks,https://e27.co/startup/antworks,https://www.ant.works,Singapore,Data & Analytics,,,,"http://www.twitter.com/AntWorksGlobal,https://www.facebook.com/AntWorksGlobal/",,,"Founded in 2015 by Asheesh Mehra and Govind Sandhu, AntWorks™ is an organization of steadfast AI enthusiasts working to make Integrated Intelligent Enterprise Automation Platforms.",Fresh. Fearless. Fast.
Best Bitcoin Exc,https://e27.co/startup/best-bitcoin-exc,https://www.pulsehyip.com/cryptocurrency-exchange-development-company,India,,,,,,,,Pulsehyip is the best Bitcoin and cryptocurrency Exchange script software provider in India enable you to create a robust Bitcoin Exchange business Website with our ready-made bitcoin exchange script.,
Antier Solutions - Cryptocurrency Exchange Development Company,https://e27.co/startup/antier-solutions-cryptocurrency-exchange-development-company,https://antiersolutions.com/cryptocurrency-exchange-development-company.html,India,,,,,"http://www.twitter.com/antiersolutions,https://www.facebook.com/antiersolutions",,,We have ardent team of cryptocurrency developers who are capable to provide cryptocurrency exchange development services at affordable pricing.,"If you are a startup or an enterprise planning to create your own cryptocurrency exchange, Antier Solutions can help. We specialize in delivering customized cryptocurrency exchange development services that align with our clients’ needs. Our crypto developers keep abreast of the latest advancements in the blockchain technology to employ the right solutions for building an advanced exchange platform. Our designers focus on all of the design aspects to ensure that the exchange is appealing and has an intuitive user interface. With a team of designers, developers, quality analysts and a project manager working together to cater your business needs, we deliver a highly-secure, scalable, feature-rich and user-friendly exchange platform that helps you to stay ahead of the competition."
mageWebin,https://e27.co/startup/magewebin,http://www.magewebin.com,India,,,,,"http://www.twitter.com/magewebin,http://www.facebook.com/magewebin,http://www.linkedin.com/company/magewebin/",,,Hire magento developers in India to build magento website for you at affordable price. mageWebin is located in Faridabad and provide services to world wide.,
sheknowsfinance,https://e27.co/startup/sheknowsfinance,http://sheknowsfinance.com,United States of America,,,,,,,,Our company deals in personal finance which share unique ideas related to online money making. Apart from this we also provide updates related sweepstakes and freebies,
Gifts N Surprise,https://e27.co/startup/giftsnsurprise,https://www.giftsnsurprise.com,India,E-commerce,September 2017,,,"http://www.twitter.com/GiftsNSurprise,https://www.facebook.com/MyGiftsNSurprise/,https://www.linkedin.com/company/giftsnsurprise/",,,Gifts N Surprise is one of the biggest e-commerce gift portals in India. The headquarters of the company is situated in the city of Bangalore.,"Gifts N Surprise is one of the biggest e-commerce gift portals in India. The headquarters of the company is situated in the city of Bangalore. By a really strong operational arrangement and organized workforce, the company has been serving its customers with doorstep delivery of gifts following a quick delivery time cycle. The company insists on qualitative products deployment. The company has an in-house kitchen at which the consumable gifts are freshly baked at the acceptance of orders. The products projected for sale are meticulously examined for its quality status by the Quality analysts at the company. Customer satisfaction is the quintessence of the work and service culture at Gifts N Surprise."
