company_name,request_url,request_company_url,location,tags,founding_date,founders,employee_range,urls,emails,phones,description_short,description
LITTLEFLOWERHUT.COM,https://e27.co/startup/littleflowerhut-com,http://www.littleflowerhut.com.sg,Singapore,E-commerce,August 2018,,,"http://www.twitter.com/littleflowerhut,https://www.facebook.com/flowerdeliverysingapore55555/,https://sg.linkedin.com/in/pipi-bibi-8b54a554",,,Little Flower Hut is all about flowers and bringing out the beauty of flower to your recipient. We are passionate about creating and delivering flowers which bring happiness for your recipient.,ABOUT LITTLE FLOWER HUT- Home Grown Florist in Singapore
SkyMagic,https://e27.co/startup/skymagic,https://skymagic.show,Singapore,Robotics,,,,,,,NEWSUBSTANCE and SKYMAGIC have come together in an exciting joint venture to deliver performance drone shows across the world.,"NEWSUBSTANCE and SKYMAGIC have come together in an exciting joint venture to deliver performance drone shows across the world. Over the last five years, both companies have been at the vanguard of drone-based light shows. By joining forces as one company with offices in Europe and Asia, SKYMAGIC is positioned to truly push the boundaries of artistic performance, harnessing the latest drone technologies to deliver spectacular entertainment solutions around the globe. SKYMAGIC combines the strengths of both companies, resulting in a formidable mix of live entertainment expertise, cutting-edge super-stable system technology and innovative creative direction."
NeuroTags,https://e27.co/startup/neurotags,https://www.neurotags.com/,India,Productivity & CRM,,,,"http://www.twitter.com/neurotags,https://www.facebook.com/neurotag/,https://www.linkedin.com/company/neurotags/",,,NeuroTags helps organizations increase their sales with the help of its smart anti counterfeit tags. Neurotags also helps in warranty activations.,NeuroTags helps organizations increase their sales with the help of its smart anti counterfeit tags. Neurotags also helps in warranty activations.
The Designer Office,https://e27.co/startup/the-designer-office,http://www.thedesigneroffice.co.uk,United Kingdom,Consumer,January 2003,,,http://www.twitter.com/TDesignerOffice,,,"The Designer Office is a name you can look forward to. If you want a stylish, lavish and eye-grabbing office with some best quality furniture and interiors.","The Designer Office is a name you can look forward to. If you want a stylish, lavish and eye-grabbing office with some best quality furniture and interiors, The Designer Office will make it possible for you. With impeccable vision and keen eyes on details, they offered some great results. They have a team of best office furniture managers with years of experience and expertise."
GEM Business Centers,https://e27.co/startup/gem-business-centers,https://gembusinesscenters.com/,India,,,,,,,,We are offering co working space in South Delhi.,
Graphics Zoo,https://e27.co/startup/graphics-zoo,https://www.graphicszoo.com/,United States of America,Design,,,,https://www.facebook.com/graphicszoo1/,,,"If you are the unlimited graphics for your work or personal use, blindly rely on Graphiczoo. We offer different kinds of graphics for your ultimate purpose. If you are the unlimited graphics.","If you are the unlimited graphics for your work or personal use, blindly rely on Graphiczoo. We offer different kinds of graphics for your ultimate purpose. We offer you various services for your different needs like:"
DGWCloud,https://e27.co/startup/dgwcloud,http://www.dgwcloud.com,India,Net Infrastructure,August 2018,,,"http://www.twitter.com/dgwcloud,http://www.facebook.com/dgwcloud,http://www.linkedin.com/company/dgwcloud",,,DGWCloud is one of the world's premier provider of web hosting solutions powered by the cloud.,"DGWCloud is a hosting solution providing company. With the presence in over 20 countries and 5 data centres across 3 continents, DGWCloud is one of the world's leading provider of web hosting (cloud), cloud server hosting, dedicated servers, semi-dedicated servers, VPS, SSL, and domain services."
Switchtorenewable,https://e27.co/startup/switchtorenewable,https://switchtorenewable.wordpress.com,United Kingdom,,,,,"http://www.twitter.com/TimothyDobson7,https://www.facebook.com/timothy.dobson.7370",,,"The UK is known for its cold and frosty climate. However, it receives enough radiation from the sun for the solar panels to function.","The UK is known for its cold and frosty climate. However, it receives enough radiation from the sun for the solar panels to function. The UK’s annual insolation ranges from 750–1,100 kilowatt-hours per square meter. It is so high that it can easily be compared with that of Germany which produces around 7% of its electricity with the help of solar power."
Talent Magnifier,https://e27.co/startup/talent-magnifier,https://www.talentmagnifier.com/,India,Training & Coaching,,,,"http://www.twitter.com/talentmagnifier,https://www.facebook.com/talentmagnifierinstitute/,https://in.linkedin.com/company/",,,"Get the most effective and trustworthy Job Oriented Certification Practical Online & Class Room training in HR Generalist, MIS & Data Analytics, MS Excel and Access, Accounts, finance and accounting,",
Sportsmatik,https://e27.co/startup/sportsmatik,https://sportsmatik.com,India,Sports,April 2018,,,"http://www.twitter.com/sportsmatik,https://www.facebook.com/sportsmatik,http://www.linkedin.com/company/18188118/",,,Sportsmatik is a unique sports platform where people may showcase their skills in sports by creating account and learn about numerous sports.,"We are introducing a digital sports platform - Sportsmatik.com that helps 22 types of users Athletes, their guardian, coaches, physiotherapists, sports doctor, Sports Nutritionist, Sports Fitness Trainer, Sports Journalist / Writer, Sports Lawyer, Sports Accountant, College / University, Sports Logistics athlete-managers, sports-officials, schools, clubs, academies, companies, sports agencies, merchants, sponsors and sports enthusiasts (and more to come) open to register for more than 165 sports played all around the world. So what are you waiting for? Join sportsmatik to connect with people and entities affiliated to sports and form your own sports network. Play, resolve, live in sports!"
Roomz,https://e27.co/startup/roomz,https://roomz.asia,Malaysia,,,,,,,,"Roomz started from a free room for rent listing platform, and expanded its business to co-living, offering fully furnished, utility included and weekly maid service room for rent in Malaysia.",
LinksManagement,https://e27.co/startup/linksmanagement,https://www.linksmanagement.com/,United Kingdom,Marketing,,,,"http://www.twitter.com/LinksManagement,https://www.facebook.com/LinkBuilding.LinksManagement/,https://www.linkedin.com/company-beta/10491999/",,,"LinksManagement offers high quality link building services for your website. We provide static, permanent backlinks from content for as low as $0,15$",
AffordADoc,https://e27.co/startup/affordadoc,https://affordadoc.com/,United States of America,,,,,"http://www.twitter.com/RealAffordadoc,https://www.facebook.com/affordadoc/",,,"AffordADoc is a leading telehealth provider, benefiting patients, employers, physician practice groups and accountable care organizations.","AffordADoc is a leading telehealth provider, benefiting patients, employers, physician practice groups and accountable care organizations."
chekr edu,https://e27.co/startup/chekr-edu,https://chekrs.com/,India,,,,,,,,Best education Portal In India,
Globaltix,https://e27.co/startup/globaltix,http://globaltix.com/,Singapore,Travel,,,,,,,GlobalTix is run by a passionate team who believes that travel should be as easy as possible.,"GlobalTix is run by a passionate team who believes that travel should be as easy as possible. Technology is the key to this, and we aim to make it as easy as possible for attractions and partners to interact and transact in an open marketplace."
MBD Books,https://e27.co/startup/mbd-books,http://mbdbooks.in/,India,,,,,"http://www.twitter.com/mbd_books,https://www.facebook.com/mbdbooks/,https://www.linkedin.com/in/mbd-book/",,,"MBD is the only publishing house in India with complete backward and forward integration, right from self-owned paper manufacturing unit to in-house pre-press facilities, in-house printing and binding","MBD is the only publishing house in India with complete backward and forward integration, right from self-owned paper manufacturing unit to in-house pre-press facilities, in-house printing and binding units, and its own distribution network with more than 37 branch offices across India. Starting with a single bookshop, the Group has now become India's leading publishing house. The group has also initiated ventures across the globe with the launch of its first publishing branch in Cape Town (South Africa). MBD is the only Indian-origin publisher to be included in the National Catalogue of South Africa. It is the only publishing house which publishes books for all classes, all subjects, all the educational boards in India and also in a few international languages. MBD also prints books for technical subjects and children's books under various imprints, popular in India and abroad. It prints more than 5,00,000 books a day. The MBD Group has eight state-of-the-art printing presses for printing quality books in various colours, configurations and sizes. MBD is the largest printer in northern India in terms of rated and certified production capacity."
Ztarkbond GmbH,https://e27.co/startup/ztarkbond-gmbh,http://www.ztarkbond.com,Germany,,November 2010,,,https://www.linkedin.com/in/nfarfan/,,,"We develop Strategies, build brand, innovate and coach. We come from Fortune 100 companies and have reached many time market leadership. We operate in Asia, Europe and US","Ztarkbond GmbH is a global strategic marketing consultancy. We create and build brands for clients ranging from new entrepreneurial start-ups to leading  global corporations. Our proven track record demonstrates Ztarkbond’s skill in developing winning brand strategies that create precise touch-points that engage customers in a meaningful way. We will define, unify and amplify your brand’s message so that it rises to the top level of consumer awareness. But that’s not all. The Ztarkbond best in class team of Fortune 100 marketers and creatives work to keep your brand’s resonance and consumer loyalty."
Data Entry Export ,https://e27.co/startup/data-entry-export,https://www.dataentryexport.com/,United States of America,,September 2013,,,,,,"Data Entry Export is one of the leading BPO company in India. We guarantee the best offshore data entry service for all types of outsourcing online and offline data entry, excel data entry etc.","Data Entry Export is one of the foremost name in providing offshore data entry, conversion, web research services in all the major sectors ranging from telecommunication, financial, Social Security organizations and government, to name a few."
photoalter,https://e27.co/startup/photoalter,http://www.photoalter.com,India,,,,,"http://www.twitter.com/photoalter,https://www.facebook.com/PhotoAlter.ImageEditingCompany/,https://www.linkedin.com/company/photoalter-com",,,"PhotoAlter.com offers high quality photo editing, image retouching and picture enhancement services to global clients at affordable prices.","PhotoAlter.com is a leading photo editing company based New Delhi, INDIA. We have customers from all across the globe including USA, UK, Sweden, Norway, France, Italy, Denmark, Australia, Canada, Switzerland etc. Our teams believe in developing long-term business relationship with our all customers. Hence, we provide 100% customer satisfaction, guaranteed privacy, fast turnaround time and affordable prices to all our customers."
Iconoffices,https://e27.co/startup/iconoffices,http://iconoffices.co.uk/virtual-offices.php,United Kingdom,,August 2016,,,,,,Icon Offices provides luxury serviced offices in the heart of East London / Essex.,Icon Offices provides luxury serviced offices in the heart of East London / Essex.
treetech,https://e27.co/startup/treetech,http://www.treetech.me,Lebanon,Augmented Reality (AR) ,June 2017,,,"http://www.twitter.com/treetech3,https://www.facebook.com/Treetech.me/,https://www.linkedin.com/in/rabih-harb-5908a97/",,,"Educational applications with a twist. Bridging the gap between educational institutions, parents, and students using the latest technology and AI…","Educational applications with a twist. Bridging the gap between educational institutions, parents, and students using the latest technology and AI…"
Islartist,https://e27.co/startup/islartist,http://www.islartist.com,Tunisia,Media,July 2017,,,"http://www.twitter.com/islartist,http://www.facebook.com/islartist",,,"Islartist -THE WORLD OF ISLAMIC ARTS - a social media for Islamic Artists where they can Upload their Islamic Arts & communicate with other Islamic Artists, Islamic Arts ,Islamic Ornament,calligraphy","AbstractArt, Abstraction, Turkish, Abu Dhabi, Islamic FloralDecoration, OttomanArt, Islamic geometry, IslamicIllumination, FloralArt, UAE, UnitedArabEmirates, Islamic patterns, MughalArt, MiddleEasternArt, Arabesque, FloralArabesque, IslamicArabesque.."
Tree Myanmar,https://e27.co/startup/tree-myanmar,http://treemyanmar.com/,Burma,Design ,June 2017,,,https://www.facebook.com/treemyanmarweb,,,Tree Myanmar is a group of professional web designers and developers who are extremely passionate about one common agenda – to see the customer smile.,
One Way Cab ,https://e27.co/startup/one-way-cab,http://caboneway.com/,India,,May 1986,,,,,,ab Oneway offers you a great deal on every ride.Why Pay for Return Journey when you are travelling one-way? Now get discounted AC Taxi for your one-way travel.,
"Hubei Jucro Electric CO., LTD.",https://e27.co/startup/hubei-jucro-electric-co-ltd,http://www.jucro.com,China,,,,,,,,"Hubei Jucro Electric CO., LTD. is a private enterprise that produces and exports high voltage electrical equipment.","Hubei Jucro Electric CO., LTD. is a private enterprise that produces and exports high voltage electrical equipment. The main products are: vacuum contactors, vacuum circuit breakers, vacuum interrupters and related accessories. The product rated voltage range covers 660KV/1.14KV/3.6KV/7.2KV/24KV/40.5KV. The rated current of the product ranges from 125A to 4000A."
DigitalPacemaker,https://e27.co/startup/digitalpacemaker,http://www.digitalpacemaker.in/,India,Computer Security,September 2017,,,"http://www.twitter.com/digitalpacemak2,https://www.facebook.com/profile.php?id=100019951231754",,,"Guwahati is largest growing cities in India. SEO in Guwahati by DigitalPacemaker provided SEO Services. DigitalPacemaker provided both On-page and Off-page SEO, local seo ,Search engine marketing.","Guwahati is largest growing cities in India. SEO in Guwahati by DigitalPacemaker provided SEO Services. DigitalPacemaker provided both On-page and Off-page SEO, local seo ,Search engine marketing digital media marketing."
Codeiographers,https://e27.co/startup/codeiographers-gmail-com,http://www.codeiographers.com/home/software-development-company-in-chennai,India,Design ,September 2017,,,"https://www.facebook.com/codeiographers,https://www.linkedin.com/company/codeiographers/",,,"Codeiographers is a software development company in Chennai which provides services such as Software consultant, Software development, and responsive designs.","We are a Product-cum-Service based startup and an ultimate destination for the Enterprise, Entrepreneurs, Small Businesses, Home Makers or any Novice’s Digital Needs and Solutions. We are the group of Creative-Passionate-Talented-Young Builders."
Appzure - Mobile App Development Company India & USA,https://e27.co/startup/appzure-mobile-app-development-company-india-usa,http://www.appzure.com,India,,,,,"http://www.twitter.com/Appzure1,https://www.facebook.com/appzure,https://in.linkedin.com/company/appzure",,,"Appzure is one of the leading mobile application development company in USA & India providing various end-to-end solutions to various businesses, startups, and digital agencies at affordable prices.","Appzure is one of the leading mobile application development company in USA & India providing various end-to-end solutions to various businesses, startups, and digital agencies at affordable prices. Our top of the line services are provided by our highly skilled technical professionals who deliver secure, scalable, and innovative IT solutions to our clients."
Filipina Wife,https://e27.co/startup/filipinawife,http://filipinawife.com,United States of America,,,,,"http://www.twitter.com/_FilipinaWife,https://www.facebook.com/Filipinawife-LLC-1765424043773648/",,,Filipina Wife is one of the best dating sites if you are looking for gorgeous and understanding women who will stand by you forever.,
EscapeWriters,https://e27.co/startup/escapewriters,https://www.escapewriters.com/,India,Entertainment,July 2017,,,"http://www.twitter.com/EscapeWriters,https://www.facebook.com/EscapeWriters/",,,"EscapeWriters is a platform for writers to express their thoughts on Life, Health, Parenting, Relationship, Travel, Tips, Inspiration & much more...",
Tranzaco,https://e27.co/startup/tranzaco,http://www.tranzaco.com,Singapore,B2B/Enterprise,June 2018,,,"http://www.twitter.com/tranzaco,http://www.facebook.com/tranzaco,http://www.linkedin/company/tranzaco",,,"Singapore's first Biztech startup that create a seamless transact-able business ecosystem to connect SMEs to bankers, property and insurance agents.","Tranzaco is founded in the first place to solve a few existing issues that many Small Medium Enterprises (SMEs) are facing. SMEs comprise of more than 90% of the job opportunities in many Asian countries, especially Singapore. It is definitely an important factor contributing to the GDP of a nation."
HIREtrades,https://e27.co/startup/hiretrades,https://www.hiretrades.com.au,Australia,Consumer,,,,"http://www.twitter.com/HIREtradesAU,https://www.facebook.com/HireTradesAustralia/,https://www.linkedin.com/company/hiretrades/",,,HIREtrades is Australia's most trusted trades provider connecting customers with reputable companies providing top trades to get the needs done for complete convenience.,"HIREtrades is Australia's most trusted trades provider connecting customers with reputable companies providing top trades such as home services, electricians, air conditioning, plumbers, handyman, builders, painters and a lot more to get the needs done for complete convenience."
SPH Digital ,https://e27.co/startup/sph-digital,https://www.sphdigital.com/,Singapore,,,,,,,,,
Coffee Village Retreat,https://e27.co/startup/coffee-village-retreat,http://www.coffeevillageretreat.com/,India,,March 1984,,,https://www.facebook.com/Coffee-Village-Retreat-422341888196651/,,,"Vacations are always the most-wanted thing that every individual want to younger to older. Though it requires a lot of things to search and fix, as a whole,",
AppWebStudios,https://e27.co/startup/appwebstudios,https://www.appwebstudios.com/,India,,,,,,,,"""We are offering Mobile Application Design & Development, Web design, Website designing, Website Design & Web Development company Gurgaon India/Gurgaon. ",
fijoy.me,https://e27.co/startup/fijoy-me,https://fijoy.me,United States of America,,,,,,,,Digital marketing professional with 3 years of experience in working with clients on their digital strategy and executions. Have hands on experience in digital space.,
BabyUniqueCorn,https://e27.co/startup/babyuniquecorn,https://babyuniquecorn.com,United Kingdom,,,,,"http://www.twitter.com/BabyUniqueCorn_,https://m.facebook.com/BabyUniquecorn/",,,BabyUniqueCorn is an enchanting online shopping space featuring independent designers and makers of children’s clothes and essential,
FunNow,https://e27.co/startup/funnow,https://www.myfunnow.com/en/,Hong Kong,Software,,,,https://www.facebook.com/funnowapp,,,"FunNow has an incredible dream - to become a top internet company from Taiwan. The FunNow app is their first step, providing real-time info & instant booking service for leisure and entertainment.",FunNow has an incredible dream - to become a top internet company from Taiwan.
Time Auction,https://e27.co/startup/time-auction,https://timeauction.org,Hong Kong,,,,,"https://www.facebook.com/timeauction/,https://www.linkedin.com/company/time-auction",,,Time Auction is a charity that connects anyone with inspiring leaders while encouraging volunteerism.,"Time Auction is a charity that connects anyone with inspiring leaders while encouraging volunteerism. By volunteering to any charity, one can join unique experiences — from dining with inspiring entrepreneurs to cooking with Michelin-starred chefs."
WeddingIdea,https://e27.co/startup/weddingidea,http://weddingideathailand.com/,Thailand,,,,,https://www.facebook.com/WeddingIdeaAndTheEventThailand/,,,Wedding Idea Thailand - one of the best wedding planner in koh samui. Offering distinctive weddings for the not so average bride.,Wedding Idea Thailand - one of the best wedding planner in koh samui. Offering distinctive weddings for the not so average bride.
Toreto Retail Pvt. Ltd.,https://e27.co/startup/toreto-retail-pvt-ltd,https://www.toreto.in,India,,,,,"http://www.twitter.com/Toreto_India,https://www.facebook.com/toreto.india/,https://www.linkedin.com/company/toreto-india/",,,"Incorporated in 2013, Toreto is Hong Kong/India based mobile and computer accessories manufacturing and supplying company in the gadget industry.","All the products are the perfect blend of streamlined design and the state-of-the-art technology. Now, it becomes a hub computer, laptop and smart phone gadgets that you need for your modern-lifestyle."
NoisyElephant,https://e27.co/startup/noisyelephant,https://noisyelephant.com,Singapore,Advertising,August 2018,,,http://www.facebook.com/thenoisyelephant,,,NoisyElephant is the simplest way to increase your market exposure and sales lead effortlessly without worrying about any marketing strategy.,We offer a managed on-demand marketing service to allow you to build your personalised online branding.
Instabug,https://e27.co/startup/instabug,http://Instabug.com,United States of America,,2013,,,"http://www.twitter.com/instabug,http://www.facebook.com/instabug,http://www.linkedin.com/in/instabug",,,"The top apps in the world rely on Instabug for bug reporting, crash reporting, and in-app user feedback.",Instabug is a comprehensive bug reporting and in-app feedback SDK that is helping companies worldwide build better apps.
LEGALNEXT,https://e27.co/startup/legalnext,http://legalnext.id,Indonesia,,April 2017,,,,,,We are Virtual Legal Assistant,"We are Virtual Legal Assistant, we help your bussiness and personal"
Payzaps,https://e27.co/startup/payzaps,http://www.payzaps.com,India,,,,,,,,,
Sugar Book,https://e27.co/startup/sugar-book,http://www.sugarbook.com,Malaysia,Social Networking,January 2017,,,https://www.facebook.com/thesugarbookofficial/,,,"200,000 Users, 1 year old explosive Social Networking/Dating Platform for adults, HQ from Malaysia, now expanding to Singapore, Hong Kong, Thailand","* Sugarbook is #1 destination for Sugar daddies, babies of all races and culture to connect and meet around the world"
APLO Construction Pty Ltd,https://e27.co/startup/aplo-construction-pty-ltd,https://www.aploconstruction.com.au,Australia,Architecture & Construction,,,,"http://www.twitter.com/homeextensionau,https://www.facebook.com/APLO-Construction-Pty-Ltd-1054828931366277/",,,"APLO Construction Pty. Ltd. provide home extension project, multi-unit developments, home renovations or new home builds service.","Located in Melbourne, APLO Construction Pty. Ltd. is one of the industry’s leading custom home builders. Whether it’s a home extension project, multi-unit developments, home renovations or new home builds, we can do it all."
Auspicious Space,https://e27.co/startup/auspicious-space,http://auspiciousspace.com/,India,,June 2016,,,https://www.linkedin.com/in/auspicious-space-a34619155/,,,We are Auspicious Space (website designing company in delhi)giving world class business services with  fully featured professional websites that can help to develop a relationship with customers.,WEBSITE DESIGNING
VintekSystem,https://e27.co/startup/vinteksystem,http://www.vinteksystem.com,United States of America,,,,,,,,,
Employee 4Hire,https://e27.co/startup/employee-4hire,https://www.employee4hire.com/,United States of America,,,,,"http://www.twitter.com/e4hInc,https://www.facebook.com/employee4hire",,,Employee4hire is a national Database of highly skilled employees for hire. You can register your company and can start searching for the right candidates.,
X Infinity,https://e27.co/startup/x-infinity,http://www.xinfinity.io/,Singapore,Finance,,,,https://www.facebook.com/xinfinityltd/,,,"X Infinity, a Singapore based Fintech Company, is creating a unified cryptocurrency wallet that allows consumers and merchants the ability to transact as easily using any blockchain asset as a currenc","X Infinity, a Singapore based Fintech Company, is creating a unified cryptocurrency wallet that allows consumers and merchants the ability to transact as easily using any blockchain asset as a currency."
